{
  "name":"departments",
  "title":"Company Departments",
  "description":"Example to datalink demo",
  "aspectName":"dlnk:departm",
  "aspectPropertyName":"dlnk:departm",
  "order":20,
  "connectorRest": {
    "url": "http://localhost:3005/api/v1/private/departments/search",
    "authentication": {
      "type":"basic",
      "username":"user2019",
      "password":"g3n3r4l"
    },
    "searchParam":"query"
  },
  "columns": [
    {
      "primaryKey":true,
      "name":"dept_no",
      "label":"Id",
      "type":"text",
      "hidden":true
    },
    {
      "primaryKey":false,
      "name":"dept_name",
      "label":"Name",
      "type":"text"
    }
  ]
}
